{
  "schema_version": "p0-roundtrip-report-v1",
  "run_id": "00112233-4455-6677-8899-aabbccddeeff",
  "git_commit": "00112233445566778899aabbccddeeff00112233",
  "snapshot": {
    "status": "complete",
    "file_count": 3,
    "total_plaintext_bytes": 128
  },
  "restore": {
    "status": "complete",
    "restored_file_count": 3,
    "total_bytes_written": 128
  }
}
